{
  "$schema": "https://json-schema.org/draft/2020-12/schema",
  "$id": "https://meshcore.ca/schemas/analyzer-location-codes.schema.json",
  "title": "MeshCore Canada observer location-code quick list",
  "type": "object",
  "required": ["schema_version", "version", "last_reviewed", "scope", "locations"],
  "properties": {
    "schema_version": {"const": 1},
    "version": {"type": "string", "pattern": "^[0-9]{4}\\.[0-9]{2}$"},
    "last_reviewed": {"type": "string", "format": "date"},
    "scope": {"type": "string", "minLength": 24},
    "locations": {
      "type": "array",
      "minItems": 1,
      "items": {
        "type": "object",
        "required": ["code", "name", "province", "province_code"],
        "properties": {
          "code": {"type": "string", "pattern": "^[A-Z]{3}$"},
          "name": {"type": "string", "minLength": 2},
          "province": {"type": "string", "minLength": 4},
          "province_code": {"type": "string", "pattern": "^[A-Z]{2}$"}
        },
        "additionalProperties": false
      }
    }
  },
  "additionalProperties": false
}
